"Resultados técnicos","son los resultados que se registran exclusivamente en un ejercicio de la aseguradora derivados de las primas cobradas, los gastos realizados, los siniestros pagados sin considerar por ejemplo los resultados de sus inversiones, reservas, etc."
"Retención","es la parte del riesgo que no se transfiere a una reaseguradora, y que es la parte que asume la aseguradora dependiendo de sus capacidades de pago, sus reservas y su solvencia económica."
"Reticencia","toda declaración falsa de circunstancias conocidas por el asegurado, aún hechas de buena fe, que a juicio de peritos hubiese impedido el contrato o modificado sus condiciones si el asegurador se hubiese cerciorado del verdadero estado del riesgo, puede hacer nulo el contrato, es decir, lo deja sin efecto desde su inicio."
"Riesgo","es la probabilidad de ocurrencia de un siniestro. Es la posibilidad de que la persona o bien asegurado sufra el siniestro previsto en las condiciones de póliza. Es el suceso incierto, futuro y susceptible de ser valorado."
"Riesgos no asegurables","son aquellos que quedan fuera de la cobertura general por parte de las aseguradoras, por ser contrarios a la ley."
"Seguro","jurídicamente hablando, es un instituto por el cual el Asegurador se obliga, mediante el cobro de una prima a abonar, dentro de los límites pactados, un capital u otras prestaciones convenidas, en caso de que se produzca el evento cuyo riesgo es objeto de cobertura. El seguro brinda protección frente a un daño inevitable e imprevisto, tratando de reparar materialmente, en parte o en su totalidad las consecuencias. El seguro no evita el riesgo, resarce al Asegurado en la medida de lo convenido, de los efectos dañosos que el siniestro provoca."
"Seguro por cuenta ajena","se denomina así a aquellos seguros en los que el asegurado no es el tomador del seguro, sino un tercero determinado o indeterminado que adquiere los derechos derivados del contrato."
"Seguros de daños","su fin principal es reparar la pérdida sufrida a causa de un siniestro en el patrimonio del asegurado."
"Seguros de personas","su fin es cubrir la vida y la integridad corporal de las personas."
"Seguros obligatorios","son aquellos que son impuestos por el Estado tales como los de seguridad social, seguro de vida obligatorio, seguro colectivo para el personal del Estado, seguro obligatorio de responsabilidad civil automotores, etc."
"Siniestro","es la realización del riesgo. Es cuando sucede lo que se está amparando en la póliza y es motivo de indemnización, por ejemplo, un robo, un choque, una enfermedad o accidente, un incendio, etc."
"Sobreprima","recargo a la prima cuando se trata de riesgos agravados."
"Subrogación","es la transferencia al asegurador de los derechos que correspondan al asegurado contra un tercero, en razón de un siniestro sufrido, hasta el monto de la indemnización que abone. El asegurado es el responsable de todo acto que perjudique este derecho del asegurador. Derecho que cede el asegurado a favor del asegurador para que éste adelante acción contra el tercero responsable del siniestro."
"Suma asegurada","es el valor asignado en la póliza como la responsabilidad máxima que debe pagar la compañía de seguros en caso de pérdida o daño a los beneficiarios de la misma."
"Supra-seguro","es cuando el valor de los bienes asegurados es mayor al valor asegurado. Las aseguradoras niegan el pago de las cantidades que exceden la suma asegurada contratada, ya que en ningún caso tuvieron conocimiento de que el valor asegurado era inferior y no cobraron la prima justa ni crearon reservas para hacerle frente a una cantidad mayor."
"Tabla de mortalidad","número de personas que respecto a un grupo determinado muere en un periodo de tiempo, generalmente un año."
"Tomador","es la persona que contrata el seguro con el Asegurador. Generalmente en los seguros individuales el tomador contrata el seguro por cuenta propia, uniéndose así en una persona dos figuras (Tomador o Contratante y Asegurado). Por el contrario el seguro es por cuenta ajena cuando el tomador es distinto del Asegurado; esta situación es típica en los seguros colectivos. Es la persona que, obrando por cuenta propia o ajena, traslada los riesgos a una aseguradora."
"Unilateral","acto jurídico que solo impone obligaciones a una sola de las partes."
"Unión de sociedades","con este término se hace referencia al conjunto de mecanismos utilizados para, con distintos grados de intensidad, unir la actividad de varias empresas societarias."
"Usuario","persona que recibe el beneficio de un producto, ya sea consumiéndolo o creando mediante un proceso posterior, otro producto destinado a la venta."
"Usufructo","Derecho de usar y gozar de una cosa cuya propiedad pertenece a otro, con tal que no se altere su sustancia."
"Validez","cualidad de un acto o contrato jurídico para que produzca todos los efectos que se deriven de su propia naturaleza y de la voluntad constitutiva."
"Valor asegurado","se llama así al máximo pagadero en caso de siniestro previamente estipulado en las condiciones de la póliza."
"Valoración del riesgo","proceso mediante el cual se establece la prioridad de que ocurran daños personales o pérdidas materiales y la cuantificación de los mismos."
"Vencimiento del seguro","finalización de los efectos de una póliza como consecuencia del cumplimiento de las condiciones previstas y determinadas de ello."
"Vitalicio","que dura desde que se obtiene hasta el fin de la vida. Suele aplicarse a cargos, rentas, pólizas de seguros, etc."
"Yacencia hereditaria","la que existe en el intervalo de tiempo que media entre la apertura de la sucesión y la adquisición y aceptación por los herederos."
"Zona de librecambio","las establecidas entre dos o más países eliminando los derechos de aduana para las mercancías procedentes de la zona afectada - cialis 5mg. Se diferencia de la unión aduanera en que ésta afecta a todo tipo de mercancías y establece un arancel común a países terceros."
"Zona Franca","sinónimo de depósito o puerto franco."
